{
  "schemaVersion": 1,
  "name": "karnel-hello",
  "version": "1.0.0",
  "description": "Minimal official plugin used to validate the Karnel plugin flow.",
  "commands": [
    "karnel-hello"
  ],
  "minKarnelVersion": "4.13.0",
  "license": "MIT",
  "checksum": "sha256:7b50c4e164cf2020ac4e6c914b887a5ffc06351b0668b6ae3cf14d22bbfd0e15",
  "capabilities": []
}
