{
  "schemaVersion": 1,
  "name": "karnel-env-paths",
  "version": "1.0.0",
  "description": "Display active Karnel paths and runtime version for diagnostics.",
  "commands": [
    "karnel-env-paths"
  ],
  "minKarnelVersion": "4.13.7",
  "license": "MIT",
  "checksum": "sha256:95a5e2b8b4cf8ab6f5e5acb5df2d115e73087830ad5ff7a2e2abb734956aed25",
  "capabilities": [
    "environment"
  ]
}
